{
  "schema_version": "1.0",
  "repository": {
    "url": "https://github.com/241880199/DevOps",
    "canonical_url": "https://github.com/241880199/DevOps",
    "commit": "d47a1523beec3311033eabf2e74c2a6ac299720d"
  },
  "environment_id": "env-draft-fixture-mode0",
  "graph_kind": "ACTUAL",
  "generated_at": "2026-09-23T09:00:00.000Z",
  "nodes": [
    { "id": "hello", "kind": "TARGET", "path": "fixtures/draft/hello" },
    { "id": "main.c", "kind": "SOURCE", "path": "fixtures/draft/main.c" }
  ],
  "edges": [
    {
      "target": "hello",
      "dependency": "main.c",
      "relation": "READS",
      "evidence": "人工契约样例：编译 hello 时读取 fixtures/draft/main.c"
    }
  ]
}
